{
  "schema": "openprose.hosted-oracle-case/1",
  "id": "hosted.backpressure",
  "revision": 1,
  "immutable": true,
  "summary": "A six-part stream stops at two in-flight records and resumes only after explicit acknowledgements and credit.",
  "phase": 5,
  "tags": ["streaming", "backpressure", "bounded", "terminal", "no-fallback"],
  "placementCandidate": "local-loop-gateway",
  "serviceScenario": "backpressure",
  "requestFixture": "cli/shared/fixtures/hosted/requests/local-loop-gateway.json",
  "actions": [{ "type": "start" }, { "type": "stream.credit", "grant": 2, "repeat": 2 }],
  "expected": {
    "exitCode": 23,
    "terminalType": "run.terminal",
    "semanticStatus": "unknown",
    "fallbackSelected": false,
    "usageAuthority": "fixture-authoritative",
    "requiredEventTypes": ["run.accepted", "assistant.delta", "usage.report", "run.terminal"],
    "error": { "code": "SEMANTIC_STATUS_UNKNOWN", "exitCode": 23 },
    "maxInFlight": 2
  }
}
