{
  "schema": "openprose.hosted-oracle-case/1",
  "id": "hosted.replay-idempotency",
  "revision": 1,
  "immutable": true,
  "summary": "A retry with the same idempotency payload reuses the run and does not repeat a side effect.",
  "phase": 5,
  "tags": ["replay", "idempotency", "correlation", "terminal", "no-fallback"],
  "placementCandidate": "local-loop-gateway",
  "serviceScenario": "local-loop-gateway",
  "requestFixture": "cli/shared/fixtures/hosted/requests/local-loop-gateway.json",
  "actions": [{ "type": "start" }, { "type": "replay", "requestId": "fixture-request-0002" }],
  "expected": {
    "exitCode": 23,
    "terminalType": "run.terminal",
    "semanticStatus": "unknown",
    "fallbackSelected": false,
    "usageAuthority": "fixture-authoritative",
    "requiredEventTypes": ["run.accepted", "run.terminal", "run.replayed"],
    "error": { "code": "SEMANTIC_STATUS_UNKNOWN", "exitCode": 23 },
    "sideEffectExecutions": 1
  }
}
