{
  "schema": "openprose.hosted-oracle-case/1",
  "id": "hosted.usage-unavailable",
  "revision": 1,
  "immutable": true,
  "summary": "Missing usage and cost evidence is represented as unavailable rather than fabricated zeros.",
  "phase": 5,
  "tags": ["usage", "billing", "unavailable-evidence", "terminal", "no-fallback"],
  "placementCandidate": "local-loop-gateway",
  "serviceScenario": "usage-unavailable",
  "requestFixture": "cli/shared/fixtures/hosted/requests/local-loop-gateway.json",
  "actions": [{ "type": "start" }],
  "expected": {
    "exitCode": 23,
    "terminalType": "run.terminal",
    "semanticStatus": "unknown",
    "fallbackSelected": false,
    "usageAuthority": "unavailable",
    "requiredEventTypes": ["run.accepted", "assistant.delta", "usage.report", "run.terminal"],
    "error": { "code": "SEMANTIC_STATUS_UNKNOWN", "exitCode": 23 }
  }
}
